{
  "slug": "fontzone108",
  "name": "Font Zone 108",
  "nameEn": "FontZone108",
  "type": "company",
  "country": "CN",
  "website": null,
  "licensePolicyUrl": null,
  "contactEmail": null,
  "description": "FontZone108为字体设计者或工作室，相关信息极少，未找到官方网站或字体发布页面。",
  "defaultLicenseType": "联系授权",
  "fonts": [
    "Btot"
  ],
  "logoUrl": null,
  "established": null
}
