{
  "slug": "xianlifang",
  "name": "临海市社发集团  乡立方",
  "nameEn": "贤理坊",
  "type": "company",
  "country": "CN",
  "website": null,
  "licensePolicyUrl": null,
  "contactEmail": null,
  "description": "贤理坊为独立字体设计者或小型工作室，相关字体信息较少，未找到官方网站或明确授权说明。",
  "defaultLicenseType": "联系授权",
  "fonts": [
    "Lhls"
  ],
  "logoUrl": null,
  "established": null
}
