{
  "slug": "44670",
  "name": "44670",
  "nameEn": "44670",
  "type": "individual",
  "country": "CN",
  "website": "https://github.com/44670",
  "licensePolicyUrl": null,
  "contactEmail": null,
  "description": "思源黑体像素化改作作者。",
  "defaultLicenseType": "免费商用",
  "fonts": [
    "思源黑体 像素"
  ],
  "logoUrl": null,
  "established": 2020
}
