{
  "slug": "new-value",
  "name": "New Value",
  "nameEn": "新价值",
  "type": "company",
  "country": "CN",
  "website": null,
  "licensePolicyUrl": null,
  "contactEmail": null,
  "description": "新价值（New Value）为字体设计者或工作室，相关信息极少，未找到以New Value为名的字体厂商官方页面。",
  "defaultLicenseType": "联系授权",
  "fonts": [
    "Cylyt"
  ],
  "logoUrl": null,
  "established": null
}
