{
  "slug": "miiiller",
  "name": "香萃 (Miiiller)",
  "nameEn": "Miiiller",
  "type": "individual",
  "country": "CN",
  "website": "https://github.com/Miiiller",
  "licensePolicyUrl": null,
  "contactEmail": null,
  "description": "香萃字体系列作者。",
  "defaultLicenseType": "免费商用",
  "fonts": [
    "香萃汲学宋",
    "香萃打字机体",
    "香萃端庄宋体",
    "香萃自在舒畅黑",
    "空缘黑体",
    "香萃刻宋",
    "香萃等粗宋",
    "香萃潮汐宋",
    "香萃零度黑",
    "香萃自在"
  ],
  "logoUrl": null,
  "established": 2020
}
