{
  "slug": "zihun",
  "name": "Shanghai ZiHun Network Technology Co.,Ltd.",
  "nameEn": "字魂",
  "type": "company",
  "country": "CN",
  "website": "https://izihun.com/",
  "licensePolicyUrl": "https://izihun.com/site/vip-authorization-v7.html",
  "contactEmail": null,
  "description": "原创字体设计与授权平台，提供大量原创中文字体，支持VIP会员制和单字体授权两种商用模式。",
  "defaultLicenseType": "付费授权",
  "fonts": [
    "Zhbtt"
  ],
  "logoUrl": null,
  "established": 2018
}
