{
  "slug": "chilltype",
  "name": "ChillType",
  "nameEn": "寒蝉字型",
  "type": "company",
  "country": "CN",
  "website": "https://github.com/Warren2060",
  "licensePolicyUrl": "https://github.com/Warren2060/ChillShouZhuo",
  "contactEmail": null,
  "description": "寒蝉字型（ChillType）由设计师Warren2060创建，推出寒蝉手拙体、寒蝉点阵体、寒蝉宽黑体、寒蝉高黑体、寒蝉德黑体等多款开源字体，基于开源字体衍生创作。",
  "defaultLicenseType": "免费商用",
  "fonts": [
    "Hcdht",
    "Hcszt",
    "Hctyt"
  ],
  "logoUrl": null,
  "established": null
}
