{
  "slug": "frex-sans",
  "name": "械黑计划",
  "nameEn": "Frex Sans Project",
  "type": "collective",
  "country": "CN",
  "website": "https://github.com/maoken-fonts/frex-sans",
  "licensePolicyUrl": "https://github.com/maoken-fonts/frex-sans/blob/main/OFL.txt",
  "contactEmail": null,
  "description": "修复 IBM Plex Sans SC 简中字形并补齐字重的开源字体计划，2025 年 IBM 开源 Plex 源码后由社区发起，先做 GB 版、可变字体同步发布。",
  "defaultLicenseType": "免费商用",
  "fonts": [
    "Frexsans"
  ],
  "logoUrl": null,
  "established": 2025
}
