{
  "slug": "zuozi",
  "name": "上海佐兹品牌设计",
  "nameEn": "做字",
  "type": "company",
  "country": "CN",
  "website": null,
  "licensePolicyUrl": null,
  "contactEmail": null,
  "description": "做字（Zuozi）为字体设计者或工作室，相关信息极少，未找到以做字为名的字体厂商官方页面。",
  "defaultLicenseType": "联系授权",
  "fonts": [
    "Zkxwt"
  ],
  "logoUrl": null,
  "established": null
}
