{
  "slug": "pintu",
  "name": "Shanghai PinTu Network Technology Co.,Ltd.",
  "nameEn": "拼图",
  "type": "company",
  "country": "CN",
  "website": null,
  "licensePolicyUrl": null,
  "contactEmail": null,
  "description": "拼图为字体设计者或工作室，相关信息极少，未找到以拼图为名的字体厂商或设计师的官方页面。",
  "defaultLicenseType": "联系授权",
  "fonts": [
    "Qtbfsxt",
    "Qthht",
    "Qtqmt",
    "Qtxht",
    "Qtxmt"
  ],
  "logoUrl": null,
  "established": null
}
